{
  "targetArn": "arn:aws:iot:us-east-1:123456789012:thing/example",
  "revisionId": "id-abc123",
  "deploymentId": "id-abc123",
  "deploymentName": "example-resource",
  "creationTimestamp": "2025-03-15T14:30:00Z",
  "deploymentStatus": "ACTIVE",
  "isLatestForTarget": "example-value",
  "parentTargetArn": "arn:aws:iot:us-east-1:123456789012:thing/example"
}